title,date,description,source
"Ini Jumlah Penonton yang Bakal Saksikan Langsung MotoGP Mandalika 2022

","\- 09/03/2022, 17:50 WIB

","Perhelatan balap motor MotoGP Mandalika 2022 tak lama lagi akan berlangsung di
Sirkuit Mandalika, Kabupaten Lombok Tengah, Provinsi Nusa Tenggara Barat.

 Pergelaran tersebut akan berlangsung pada 18-20 Maret 2022.

 Berkenaan dengan MotoGP Mandalika 2022 tersebut, Indonesia Tourism Development
Corporation (ITDC) bersama Mandalika Grand Prix Association (MGPA) membuka
untuk umum Mandalika GP Hub.

 Wahana untuk memperkenalkan sekaligus mendekatkan masyarakat pada MotoGP itu
berada di Rasuna Epicentrum, Jalan Rasuna Said, Jakarta Selatan.

 ""Mandalika GP Hub merupakan bagian dari balapan MotoGP di Sirkuit Mandalika,""
kata Wakil Direktur Utama Mandalika Grand Prix Association (MGPA) Cahyadi
Wanda saat membuka Mandalika GP Hub pada Selasa (8/3/2022).

 Pada kesempatan itu juga, kata Cahyadi, pihaknya memperkenalkan 15 perusahaan
yang sudah berkomitmen menjadi sponsor

 Para sponsor itu adalah Pertamina, Telkom Indonesia, Telekomunikasi Selular
(Telkomsel), Bank Rakyat Indonesia, Bank Mandiri, Perusahaan Gas Negara (PGN),
GoTo Gojek Tokopedia, Pembangunan Perumahan, Aprilia Indonesia, Astra Honda
Motor, J&T; Express, Bank Tabungan Negara, TDR High Performance Technology,
RCB (Racing Boy), dan KYT Helmet.

 Cahyadi menerangkan pula bahwa Mandalika GP Hub terbuka untuk umum mulai 8-20
Maret 2022.

 ""Di Mandalika GP Hub tersedia tempat penjualan tiket MotoGP Mandalika 2022,""
ucap Cahyadi.

 Selain tempat penjualan tiket, di Mandalika GP Hub tersedia gerai layanan
cukur rambut dan simulator motor MotoGP.

 Sementara itu, penulusuran

 ""Tiket itu ada di Zona J dan K,"" kata petugas tiket, Grace, menerangkan.

 Harga tiket di Premium Grandstand itu adalah Rp 2.300.000 per tiket.

 Grace memaparkan, pemegang tiket Premium Grandstand bisa menyaksikan balapan
untuk gelaran pada 19 dan 20 Maret 2022.

 Pada kesempatan itu juga, Cahyadi Wanda menyebut bahwa pada laga balapan
MotoGP Mandalika 2022 akan hadir 63.000 penonton.

 Mereka menyaksikan langsung di lokasi Sirkuit Mandalika.

 Sementara itu, Direktur Keuangan, Strategi, dan Manajemen Risiko Indonesia
Tourism Development Corporation (ITDC) Nugdha Achadie dalam acara itu
mengatakan bahwa Dorna Sport, pemegang hak balapan MotoGP juga akan
mengirimkan timnya hadir di Mandalika.

 Nugdha mengatakan tim Dorna Sports akan hadir dengan kekuatan 2.000 orang.

 ""Kita mesti bisa menyervis tamu-tamu itu,"" kata Nughda.

 Nughda memberikan catatan juga bahwa Sirkuit Mandalika ada di dalam Kawasan
Ekonomi Khusus (KEK) Mandalika.

 Luas KEK mencapai 1.175 hektar.

 Sementara, garis pantai Mandalika panjangnya hingga 16 kilometer.

 Sedikitnya, ada lima pantai di Mandalika yang menjadi destinasi wisata yakni
Tanjung Aan, Gerupuk, Batu Berang, Kuta Mandalika, dan Pantai Seger.

 Mandalika, kata Nughda Achadie adalah satu dari lima destinasi pariwisata
superprioritas Indonesia.

 ",www.kompas.com
"Diimingi Anaknya Bakal Jadi ASN, Ibu di OKU Ditipu Dukun Palsu hingga Ratusan
Juta Rupiah

","\- 07/03/2022, 17:01 WIB

","\- Lantaran tergiur anaknya akan diterima sebagai aparatur sipil negara (ASN)
di Kementerian Hukum dan HAM (Kemenkumham), FK (44) menjadi korban

 Kejadian itu terungkap setelah pelaku, yaitu MA (29), ditangkap jajaran
Satreskrim Polres Ogan Komering Ulu (OKU), Sumatera Selatan, usai dilaporkan
oleh korban.

 Kasi Humas Polres OKU AKP Mardi Nursal mengatakan, kejadian itu berlangsung
pada Minggu (5/9/2021).

 Saat itu, MA bersama istrinya datang ke rumah korban yang berada di Kecamatan
Baturaja Timur, Kabupaten OKU, Sumatera Selatan.

 MA lalu menawarkan kepada FK agar anaknya lulus mengikuti seleksi penerimaan
ASN di Kemenkumham dengan cara melakukan ritual khusus.

 Tergiur dengan tawaran tersebut, FK lalu memberikan uang sebesar Rp 5 juta
kepada MA.

 “Uang tersebut menurut pelaku untuk membeli alat pedukunan,” kata Mardi, Senin
(7/3/2022).

 Setelah memberikan uang, keesokan harinya MA kembali mendatangi rumah korban
dengan membawa kendi berisi tasbih.

 “Kendi itu diminta tersangka untuk dikubur di belakang rumah korban sebagai
syarat,” ujarnya.

 Selama proses seleksi ASN berlangsung, MA memanfaatkan situasi tersebut untuk
menguras uang korban.

 Ia meminta uang secara bertahap yang dikirim ke rekening pelaku.

 “Totalnya mencapai Rp 220 juta yang dikirim korban ke pelaku. Tapi sampai
akhir seleksi, ternyata anak korban tak lolos dan tersangka melarikan diri,”
jelasnya.

 Merasa telah ditipu, FK pun melapor ke Polres hingga pelaku pun ditangkap saat
sedang bersembunyi di Kota Palembang, Sumatera Selatan.

 “Tersangka dikenakan Pasal 372 dan Pasal 378 KUHP tentang penipuan dan
penggelapan dengan ancaman penjara selama lima tahun,” tegas Mardi.

 ",www.kompas.com
"Lewat Warung Rojali, Kemenparekraf Promosikan Produk Ekonomi Kreatif dan UMKM

","\- 02/03/2022, 15:56 WIB

","\- Kementerian Pariwisata dan

 Melalui promosi, Kemenparekraf berharap dapat menciptakan lapangan kerja dan
mendorong kebangkitan ekonomi yang merupkan salah satu misi dari kementerian
ini

 Adapun salah satu promosi yang dilakukan Kemenparekraf/BPEK adalah melalui
kegiatan Warung Rojali atau warung rombongan jadi beli yang diadakan secara
daring dengan memanfaatkan fitur siaran langsung di aplikasi media sosial
(medsos).

 Dalam siaran pers yang diterima

 Kegiatan itu dilaksanakan mulai Jumat (25/2/2022) hingga Senin (28/2/2022)
melalui siaran langsung di akun medsos TikTok @warungrojali bersama dengan
Menteri Pariwisata dan Ekonomi Kreatif (Menparekraf) Sandiaga Salahuddin Uno.

 

 Warung Rojali menampilkan berbagai macam

 Promosi dan ulasan dari masing-masing jenama diberikan oleh Sandiaga saat
siaran langsung di akun TikTok @warungrojali. Penonton menyaksikan pun dapat
langsung membeli dengan menekan produk yang muncul saat dipromosikan di
tayangan.

 “Yang ingin saya garis bawahi adalah kita (masyarakat) semua wajib membeli

 

 Tak hanya itu, ia berharap, kegiatan Warung Rojali dapat menjadi awal
kebangkitan ekonomi dan penciptaan lapangan kerja melalui promosi subsektor
ekonomi kreatif Indonesia.

 Begitu pula masyarakat Indonesia, sebut Sandiaga, diharapkan dapat lebih
mencintai produk lokal Indonesia dan terus mendukung kampanye
#BanggaBuatanIndonesia dan #BeliKreatifLokal.

 ",www.kompas.com
"Mau Beli Dollar AS? Intip Kurs Rupiah Hari Ini

","\- 17/02/2022, 10:01 WIB

","

 Melansir data

 Analis Bank Mandiri Reny Eka Putri mengatakan, pergerakan rupiah masih
didukung aliran modal asing yang masih terus berlanjut ke pasar domestik
seiring pemulihan ekonomi.

 

 ""Pasar merespons hasil Fed Minutes yang menyatakan akan mulai menaikkan suku
bunga seiring inflasi yang tinggi,"" kata Reny kepada Kompas.com.

 Kurs referensi Jakarta Interbank Spot Dollar Rate (Jisdor), rupiah berada pada
level Rp 14.278 per dollar AS pada Rabu (16/2/2022), atau menguat dibandingkan
sebelumnya Rp 14.292 per dollar AS.

 Adapun

 Sementara untuk kurs beli di CIMB Niaga adalah Rp 14.187 per dollar AS. Kurs
beli ini berarti bila Anda ingin menjual dollar AS maka pihak bank akan
membelinya pada posisi ini.

 Berikut kurs rupiah per dollar AS hari ini di 5 bank:

 ",www.kompas.com
"5 Dampak Perang Rusia-Ukraina bagi Indonesia, Apa Saja?

","\- 03/03/2022, 10:30 WIB

","\- Perang yang terjadi antara Rusia dengan Ukraina turut berdampak ke
Indonesia.

 Ekonom Universitas Gajah Mada (UGM) Eddy Junarsin mengatakan, perang tersebut
memberi dampak yang cukup serius kepada Indonesia. Hal ini karena efek
globalilasi.

 Akibat globalisasi, efek positif yang diterima oleh Indonesia adalah dapat
menikmati teknologi yang sama baiknya dengan negara lain serta pendidikan
kelas dunia.

 Sedangkan efek negatif globalisasi, jika terjadi sesuatu di belahan dunia lain
maka akan cepat berdampak ke Indonesia.

 ""

 Eddy memaparkan bahwa dampak perang akan terasa pada aliran uang yang ada di
Indonesia.

 Sehingga, jika perang yang terjadi berlarut-larut dapat menyebabkan nilai
tukar rupiah terhadap dollar AS mengalami pelemahan.

 ""Jadi kemungkinan jika perang berlarut-larut, ya mata uang rupiah akan
terdepresiasi terhadapt dollar AS,"" ungkapnya.

 ""Jadi nilai tukar rupiah yang melemah sekarang bukan karena kinerja rupiah
yang buruk, melainkan karena dampak perang yang terjadi,"" lanjutnya.

 Ketika dalam kondisi ini, orang juga akan mencari tempat yang aman untuk
berinvestasi.

 Maka dari itu, orang akan cenderung memegang aset yang bersifat

 Eddy menyebutkan kemungkinan harga emas akan mengalami kenaikan karena kondisi
tersebut.

 Pasar modal otomatis akan mengikuti tren yang dialami oleh nilai tukar rupiah
terhadap dollar Amerika dan isu global yang sedang terjadi.

 Eddy memaparkan bahwa kemungkinan pasar modal Indonesia mengalami sedikit
penurunan, hal ini wajar karena di seluruh dunia juga mengalami tren yang
sama.

 Namun, untuk dana dari investor asing di pasar modal Indonesia masih relatif
stabil.

 ""Tapi beberapa hari ini kita lihat masih

 ""Walaupun, kemarin sempat mencatatkan lebih dari 100 miliar rupiah

 Dampak perang Rusia-Ukraina yang paling terasa bagi Indonesia salah satunya
adalah pada bidang ekspor.

 Eddy menyebut, nilai ekspor Indonesia ke Rusia pada bulan Januari berada di
angka 170 juta dollar AS, sedangkan untuk Ukraina sebesar 5 juta dollar AS.

 ""Kan lumayan ya, itu sebulan lho, per bulan,"" tegasnya.

 Karena perang, Rusia akan terkena embargo perdagangan, sehingga Indonesia
tidak dapat melakukan ekspor ke Rusia.

 ""Jika tidak dapat melakukan ekspor ke Rusia maka Indonesia akan kehilangan
pendapatan sebesar 170 juta dollar AS dari hasil ekspor karet, lemak hewan,
dan kakao,"" katanya lagi.

 Hal ini menjadi masalah jika embargo itu dilakukan berbulan-bulan, sehingga
indonesia kehilangan tempat ekspor.

 Selanjutnya, dengan adanya perang Rusia-Ukraina, secara tidak langsung juga
berdampak ke Anggaran Pendapatan dan Belanja Negara (APBN) Indonesia.

 Dengan diembargonya Rusia, dapat dipastikan harga minyak akan meroket.

 Eddy memperkirakan saat ini harganya sudah tembus lebih dari 100 dollar AS per
barel.

 APBN Indonesia sendiri mengasumsikan nilai per barel minyak di angka sekitar
60-65 dollar AS.

 ""Kalau

 Padahal, APBN Indonesia melakukan subsidi di BBM, subsidi minyak tanah, dan
subsidi LPG.

 Di setiap peningkatan 1 dollar per barel akan memberi beban APBN sebanyak Rp
2,5 trilliun lebih, untuk minyak tanah sekitar Rp 50 milliar, sedangkan untuk
LPG sebesar Rp 1,5 trilliun.

 ""Bayangkan

 ""Mungkin itu yang paling berat

 Selain harga minyak, kemungkinan harga komoditas gandum juga akan mengalami
kenaikan.

 Pasalnya, Indonesia mengimpor gandum dari Ukraina yang dipakai sebagai bahan
utama pembuat roti hingga mi instan.

 Impor gandum Indonesia terbilang tinggi, menurut data Badan Pusat Statistik
(BPS), Ukraina berada di urutan pertama sebagai pengimpor gandum di Indonesia.

 Secara keseluruhan pada 2020, total impor gandum Indonesia sebanyak 10,299
juta ton.

 Dengan demikian, Ukraina berkontribusi pada lebih dari 20 persen stok gandum
di Tanah Air.

 ""Ini yang perlu diantisipasi. Beberapa produk makanan kita cukup bergantung
dari gandum. Jadi bisa mempengaruhi harga jual misalnya mi instan, ataupun
roti, dan produk gandum turunan lainnya,"" kata Direktur Eksekutif Center of
Law and Economic Studies (Celios) Bhima Yudhistira, dikutip dari

 Namun kata Bhima, penyesuaian harga tetap bergantung pada para pengusaha di
bidang makanan dan minuman yang bahan utamanya banyak dari gandum.

 Dia berharap kenaikan harga tidak terjadi merata, mengingat warga sudah
dibebankan dengan kenaikan beberapa komoditas lainnya, seperti daging sapi,
minyak goreng, hingga kedelai.

 ",www.kompas.com
"Mau Tukar Valas? Cek Kurs Rupiah Hari Ini

","\- 18/02/2022, 10:15 WIB

","\- Nilai tukar rupiah terhadap dollar AS bergerak melemah di pasar spot pada
Jumat (18/2/2022).

 Dilansir dari data

 Analis Bank Mandiri Reny Eka Putri mengatakan, pergerakan rupiah dipengaruhi
oleh kekhawatiran tensi geopolitik antara AS, Russia, dan Ukraina yang kembali
meningkat.

 ""Rupiah dibayangi masalah geopolitik AS, Rusia dan Ukraina. Selain itu
ekspektasi normalisasi kebijakan The Fed yang makin cepat juga dicermati oleh
pelaku pasar,"" kata Reny kepada Kompas.com.

 

 Kurs referensi

 Adapun kurs di bank-bank besar di Indonesia, seperti di BNI, kurs jual dipatok
pada Rp 14.369 per dollar AS. Kurs jual berarti pihak bank menjual dollar AS
pada posisi ini.

 Sementara untuk kurs beli di BNI adalah Rp 14.257 per dollar AS. Kurs beli ini
berarti bila Anda ingin menjual dollar AS maka pihak bank akan membelinya pada
posisi ini.

 

 Berikut nilai tukar rupiah per dollar AS hari ini di 5 bank:

 

 BNI 14.369 14.257

 Mandiri 14.305 14.275

 BCA 14.321 14.306

 BRI 14.325 14.310

 CIMB Niaga 14.275 14.245

 ",www.kompas.com
"Komisi D DPRD DKI Soroti Pinjaman PEN Dinas SDA yang Baru Terserap 66,74
Persen

","\- 04/03/2022, 12:00 WIB

","\- Ketua Komisi D DPRD DKI Jakarta Ida Mahmudah mengatakan, pemerintah pusat
memberikan peringatan kepada Gubernur DKI Jakarta Anies Baswedan karena
pinjaman Pemulihan Ekonomi Nasional (PEN) yang ada di Dinas Sumber Daya Air
hanya terserap 66,74 persen.

 Pemerintah pusat, kata Ida, sudah memberikan perpanjangan waktu penyerapan
anggaran PEN dan diselesaikan pada akhir Maret 2022.

 ""Kita kemarin permintaan perpanjangan waktu, kalau bulan Maret kan hanya
tinggal sebulan lagi,"" ucap Ida dalam keterangan tertulis dikutip

 Ida mengatakan, total pinjaman PEN yang ada di Dinas Sumber Daya Air (SDA) DKI
Jakarta untuk penanggulangan banjir Jakarta sebesar Rp 1,1 triliun.

 Dari anggaran tersebut, yang baru terealisasi sebesar Rp 764,5 miliar.
Sedangkan sisanya Rp 371 miliar belum terpakai.

 ""Dengan sisa anggaran Rp 371 miliar harus secepatnya direalisasikan,"" kata
Ida.

 Dari Pemprov DKI, pinjaman yang kini tersisa Rp 371 miliar itu optimis bisa
terealisasi dengan baik hingga batas waktu yang diminta pemerintah pusat.

 Kepala Dinas SDA DKI Jakarta Yusmada Faizal menjelaskan, program penanganan
banjir sudah disusun sesuai standar pedoman dan manual (SPM) dan bisa
terlaksana dengan cepat.

 ""Dari Rp 371 miliar sudah ada

 Sisa dana Rp 371 miliar itu akan dialokasikan untuk pemeliharaan 13 sungai
besar di Jakarta yaitu Sungai atau Kali Sunter yang berada di Kelurahan
Cipinang Melayu, Kelurahan Pondok Bambu, Kelurahan Cipinang Muara.

 Selanjutnya, Sungai atau Kali Ciliwung yang berada di Kelurahan Rawajati,
Kelurahan Pejaten Timur, Kelurahan Tanjung Barat, Kelurahan Cawang, Kelurahan
Bale Kambang, Kelurahan Cililitan dan Kelurahan Gedong.

 Kemudian, Kali Angke yang berada di Kelurahan Duri Kosambi, Kelurahan
Kembangan Selatan dan Kali Jati Kramat di Kelurahan Pondok Kelapa.

 ",www.kompas.com
"Puan Dukung Upaya TNI-Polri Kawal Pemerintah Jalankan Program PEN

","\- 02/03/2022, 14:34 WIB

","– Ketua Dewan Perwakilan Rakyat (DPR) Republik Indonesia (RI) Puan Maharani
mendukung upaya Tentara Nasional Indonesia dan Kepolisian Republik Indonesia
(TNI-Polri) mengawal pemerintah menyelenggarakan program Pemulihan

 “Kebijakan negara pada program PEN diarahkan untuk membantu pelaku usaha dapat
bertahan dan tetap dapat menjalankan usahanya,” katanya saat memberi
pembekalan di Rapat Pimpinan (Rapim) TNI-Polri Tahun Anggaran 2022 di Markas
Besar (Mabes) TNI, Cilangkap, Jakarta, Selasa (01/03/2022).

 Puan menegaskan, kegiatan

 Oleh karenanya, Politisi PDI-Perjuangan itu meminta semua pihak bergotong
royong membawa Indonesia bangkit.

 Menurutnya, kompleksitas permasalahan yang ditimbulkan pandemi Covid-19
menjadi tantangan besar bagi pemerintah untuk dapat mengendalikan dampaknya
yang semakin meluas.

 “DPR RI ikut memberikan dukungan kepada pemerintah untuk dapat mengambil
tindakan cepat dan responsif dalam menyelamatkan kehidupan rakyat,” ujarnya
dikutip dari dpr.go.id, Rabu (2/3/2022).

 Puan pun mengingatkan dua agenda strategis nasional yang perlu menjadi
perhatian, yakni PEN dan

 “TNI-Polri dalam situasi menghadapi pandemi Covid-19, khususnya dalam ikut
mengawal PEN dan

 Perempuan pertama yang menjabat sebagai Ketua DPR tersebut juga menyinggung
dampak pandemi di bidang ekonomi yang terlihat dari terkontraksinya
pertumbuhan ekonomi Indonesia.

 Pada 2022, pertumbuhan

 Puan berharap, pemulihan ekonomi dapat diperkuat dan dipercepat sehingga
pertumbuhan ekonomi nasional akan semakin meningkat.

 “Dampak pandemi juga dirasakan langsung oleh masyarakat usia kerja. Yang
terdampak pandemi, mencapai 21,3 juta penduduk atau 10,3 persen dari usia
kerja. Jumlah yang sangat signifikan,” katanya.

 Sementara itu, dampak pandemi pada dunia usaha mendapati lebih dari 5 juta
pelaku usaha Indonesia mengalami tekanan selama pandemi Covid-19. Untuk itu,
dibutuhkan restrukturisasi kredit di perbankan mencapai lebih dari Rp 800
triliun.

 “Oleh karena itu, pemerintah dengan dukungan DPR RI menjalankan program PEN
yang diarahkan pada bantuan untuk usaha mikro kecil menengah (UMKM), insentif
perpajakan untuk dunia usaha, serta relaksasi dan restrukturisasi kredit
usaha,” paparnya.

 Puan pun mengingatkan, negara tak bisa berpasrah diri dalam menghadapi situasi
pandemi Covid-19 dan dampaknya yang luas.

 Mantan Menteri Koordinator Pembangunan Manusia dan Kebudayaan (Menko PMK) itu
mengatakan, negara harus melakukan upaya-upaya terbaik dalam rangka mewujudkan
tujuan bernegara.

 “Upaya itu untuk melindungi segenap bangsa Indonesia dan seluruh tumpah darah
Indonesia, memajukan kesejahteraan umum, mencerdaskan kehidupan bangsa, dan
ikut melaksanakan ketertiban dunia,” ungkapnya.

 Puan juga menjelaskan DPR telah melakukan berbagai upaya untuk membantu
penanganan pandemi Covid-19.

 Salah satunya adalah pengesahan Undang-Undang (UU) Nomor 2 Tahun 2020 tentang
Penetapan Perppu 1 Tahun 2020 tentang Kebijakan Keuangan Negara dan Stabilitas
Sistem Keuangan untuk Penanganan Pandemi Covid-19.

 Puan menilai, pengesahan UU tersebut menjadi landasan bagi pemerintah untuk
melakukan langkah-langkah luar biasa dalam memperkuat fiskal anggaran
pendapatan dan belanja negara (APBN).

 Hal tersebut penting untuk dapat melakukan pemulihan sosial, meningkatkan
ekonomi nasional, serta reformasi struktural.

 Dengan begitu, lanjutnya, Indonesia tidak mengalami krisis kesehatan, krisis
ekonomi, dan krisis sosial yang dalam.

 ",www.kompas.com
"Berapa Nilai Ekonomi Hutan Lindung Sungai Wain?

","\- 07/03/2022, 13:53 WIB

","adalah kawasan yang sering kali diabaikan manfaatnya hanya karena tidak
menghasilkan rupiah.

 Padahal fungsi hutan sangat jelas, sebagai penyimpan karbon, penyedia cadangan
air, sumber keanekaragaman hayati, hingga tempat pariwisata alam.

 Namun, seberapa besarkah jasa hutan bila dihitung secara ekonomi?

 Dalam ilmu ekonomi, ada metodologi yang dikenal sebagai valuasi ekonomi.
Valuasi ekonomi akan memberikan informasi tentang nilai moneter dari sumber
daya alam atau jasa lingkungan sehingga bisa dijadikan pertimbangan pengambil
keputusan.

 Yayasan

 (HLSW) merupakan bagian dari wilayah kerja KPHL Balikpapan dengan luas 11.246
ha.

 Hutan yang tersisa di Balikpapan ini ternyata memiliki cadangan karbon tinggi.
Setidaknya 72 persen dari luas total hutannya berpotensi menyimpan cadangan
karbon sekitar 178- 222 ton C/ha.

 Keanekaragaman hayati fauna juga cukup tinggi. Terdapat 94 jenis hewan
menyusui, sebanyak 45 spesies di antaranya merupakan jenis yang dilindungi.

 Kemudian 234 spesies burung dan 32 spesies di antaranya merupakan spesies
dilindungi, 17 jenis amphibi, 17 jenis ikan, serta 126 jenis serangga.

 Keanekaragaman hayati yang tinggi bisa memberikan jasa lingkungan melalui;
wisata alam; penjaga kualitas air; sumber udara bersih dan penyimpan karbon;
sumber pendapatan masyarakat sekitar dari pertanian; penyedia Hasil Hutan
Bukan Kayu (HHBK).

 Hitungan pertama, datang dari jasa lingkungan wisata alam. Hasil studi
merekomendasikan untuk ekplorasi HLSW dengan konsep wisata minat khusus yang
disesuaikan dengan daya dukung lingkungan.

 Konsep tersebut diharapkan dapat menjaga fungsi hutan lindung sebagai
tangkapan air, pengendalian erosi, penelitian, pendidikan dan pelestarian
keanekaragaman genetik dan spesies.

 Masih dalam wilayah ini, juga bisa ditemukan Kebun Raya Balikpapan yang
dikelola Lembaga dan Ilmu Pengetahuan Indonesia (LIPI).

 Wisatawan umum, bisa memilih ke Kebun Raya yang memang difungsikan untuk
wisata massal.

 Hasil studi menujukkan setidaknya Rp 90 juta diperoleh per tahunnya dari
kunjungan wisata di HLSW. Angka tersebut bisa menjadi nilai jasa lingkungan
wisata alam.

 Jasa lingkungan kedua dari Hutan Lindung Sungai Wain adalah penjaga kualitas
air. Air adalah sumber daya alam strategis.

 Apalagi di Sungai Wain ini terdapat waduk yang dijadikan baku mutu sumber mata
air untuk kota Balikpapan dan PT Pertamina.

 Dari hitungan pajak air permukaan saja, setidaknya waduk Sungai Wain bisa
memberikan pendapatan daerah sebesar Rp 600 juta per tahun dari penggunaan air
oleh PT Pertamina sekitar 6 juta meter kubik per tahun dikalikan pajak air
tanah sebesar Rp 100 per meter kubik.

 Bila menggunakan pendekatan penghematan pengadaan air bersih, bisa dihitung
terdapat selisih Rp 6 ribu per meter kubik air, dibanding pemerintah kota
Balikpapan memanfaatkan air laut yang memakan ongkos Rp 8.500 per meter kubik
air.

 Selisih biaya tersebut, dapat dipandang sebagai

 Nilai surplus yang bisa diperoleh dari penghematan pengadaan air bersih
sebesar Rp 5.900 per meter kubik (Nilai WTP Rp 6.000-Pajak Air Tanah Rp 100).

 Total surplus dikalikan dengan penggunaan air bersih tahunan yang diambil data
dari PT Pertamina, yaitu sekitar 6 juta meter kubik, maka akan diperoleh nilai
jasa lingkungan air bersih sebesar Rp 35,4 miliar per tahun.

 Beranjak ke jasa lingkungan ketiga sebagai sumber udara bersih dan penyimpan
karbon, peran HLSW sangat besar.

 Kandungan karbon terbesar, berada di hutan primer (222 ton c/ha), kemudian
berurutan di hutan sekunder tua (178 ton c/ha), dan hutan sekunder muda
(belukar).

 Apabila kondisi ini tetap terjaga dengan siklus pertumbuhan tegakan yang
berlangsung, maka luasan hutan primer terus bertambah dan bisa menjadi modal
bagus untuk potensi biomassa dan karbon.

 Pada poin keempat, yaitu sumber pendapatan dari pertanian, diambil dari
pendapatan warga yang mengelola sebagian kawasan dalam skema Hutan
Kemasyarakatan program Perhutanan Sosial.

 Rerata pendataan para pekebun buah sekitar Rp 5,8 miliar per tahun yang bisa
dijadikan nilai jasa lingkungan pertanian.

 Kemudian, dari sisi jasa lingkungan HHBK, ternyata HLSW memberikan pendapatan
warga setidaknya Rp 131 juta per tahun.

 Di luar manfaat jasa lingkungan di atas, HLSW juga memiliki manfaat tidak
langsung sebagai pelindung sedimentasi Waduk Sungai Wain.

 Keberadaan hutan bisa mengurangi upaya pengerukan yang menghabiskan sekitar Rp
9 miliar per tahunnya yang menjadi nilai jasa perlindungan HLSW.

 Totalnya, sekitar Rp 50,5 miliar per tahun yang menjadi nilai ekonomi dari
ekosistem Hutang Lindung Sungai Wain.

 Nominal tersebut berasar dari perhitungan potensi jasa lingkungan air (Rp 35,4
miliar), pertanian (Rp 5,8 miliar), wisata alam (Rp 90 juta), HHBK (Rp 131
juta), dan perlindungan sedimentasi (Rp 9 miliar).

 Ternyata masih ada satu lagi yang bisa menjadi nilai ekonomi yang besar dari
Sungai Wain, yaitu penyimpan karbon.

 Kandungan karbon berpotensi menghasilkan tambahan pendapatan sebesar Rp 13,5
miliar per tahun.

 Dengan demikian, nilai ekonomi total HLSW menjadi sebesar Rp 64 miliar per
tahun. Angka yang besar untuk areal seluas 11.000 hektare ini.

 Lalu, pertanyaan selanjutnya, mau dibawa kemana data-data ilmiah tersebut?
Data bisa menjadi sumber pengelolaan Hutan Lindung Sungai Wain yang digawangi
oleh KPHL Balikpapan.

 Namun, untuk menerjemahkan data menjadi sumber pendapatan aktual, maka hasil
studi merekomendasikan landasan hukum untuk memanfaatkannya, apalagi bila
pengelolaan HLSW dilakukan secara multipihak.

 Memang mustahil menyerahkan semuanya kepada KHPL Balikpapan. Maka, pekerjaan
rumah selanjutanya adalah identifikasi dan analisis pemangku kepentingan untuk
berbagi peran siapa mengerjakan apa.

 Karena, Hutan Lindung Sungai Wain itu hutan kita bersama.

 ",www.kompas.com
